id,title,organization,orglogo,dateposted,datevalidthrough,locations_raw,locations_derived,locationtype,locationrequirements_raw,salary_raw,employmenttype,url,source,description
826885368,"Group Director, Cyber Security Response & Resilience",CHANEL,,2024-09-06T00:00:00+00:00,,"[{'@type': 'Place', 'address': {'@type': 'PostalAddress', 'addressCountry': 'United States of America', 'addressLocality': '9 West Office'}}]",['United States'],,,,['FULL_TIME'],https://cc.wd3.myworkdayjobs.com/ChanelCareers/job/New-York-NY/Group-Director--Cyber-Security-Response---Resilience_JOBREQ00095412,workday,"{'text': 'Group Director, Cyber Security Response & Resilience At Chanel, we are focused on creating an inclusive culture that nurtures personal growth, contributing to collective progress. We believe the uniqueness of each individual increases the diversity, complementarity and effectiveness of our teams. We strongly encourage your application, as we value the perspective, experience and potential you could bring to CHANEL. About the Role: CHANEL is looking for a Group Director, Cyber Security Response & Resilience to join our US InfoSec Team in New York City. You will play a leading role, reporting directly to the Head of Information Security. The ideal candidate is responsible for developing, implementing, enhancing, and overseeing information security operations, response, and resiliency within Chanel USA’s environment while enabling the business in a service-oriented Technology department. This role will translate technology and business risk requirements into processes and controls while developing metrics for measuring performance and risk reduction. It will interface and work closely with our corporate and global business partners across all regions and divisions of Chanel. Our ideal candidate will demonstrate a unique blend of leadership, information security domain expertise, strong technical acumen, business judgement, creativity, entrepreneurial spirit, communication skills and embrace diverse perspectives. What impact you can create at CHANEL: Through a deep understanding of the Chanel environment and technology stack including on-prem, cloud, and hybrid platforms as well as third parties, you will oversee company security event monitoring and incident response solutions and processes. Working across tooling and with our global security and infrastructure partners, you will oversee our vulnerability management program breaking down complex systems ensuring appropriate actioning, tracking, and ownership to minimize our risk exposure. In coordination with Tech leadership, Legal, and business heads, you will advise on disaster recovery readiness to ensure tech resiliency in business continuity planning. As a critical thinker and a doer, you will not just identify continuous monitoring, security operations, and resiliency program gaps but design them, oversee implementation, and influence adoption through dynamic steering. You will drive evolution by risk taking as a Tech leader, acting expeditiously in making decisions and recommendations, understanding the factors associated with decision-making in a matrix style organization. You are energized by: Delivering security as a service to a large, complex organization with both online and physical retail presence in a rapidly growing environment with cyber threats that are continuously evolving. Developing and elevating security processes for efficiency and easy adoption while delivering high quality scalable solutions that minimize our cyber risk. Fostering a message that information security enables the business and its objectives by educating and garnering awareness to a range of audiences, both technical and non-technical, while also actively listening to their needs ensuring alignment with program versus organizational objectives. Working in a highly collaborative environment as a courageous leader and developing talent to support the growth of the business. Navigating complexity and monitoring risk on the regional and global level in close partnership with the wider Information Security team driving consistent transformation and change. What you will bring to the team: Extensive Experience: Minimum of 10 years in technology, 8 years in hands-on information security roles, with demonstrated progression in responsibility and oversight. At least 3 years should be in a leadership capacity, managing teams effectively. SOC and Incident Management: Proven experience in leading a Security Operations Center (SOC) or managing an incident and crisis response team, with a track record of driving improvements in these areas. Vulnerability Management: Expertise in vulnerability management, including the use of scanning tools and performing in-depth analysis to identify and mitigate risks. Cloud Security Monitoring: In-depth knowledge of cloud security and cloud-native environments, including experience with major cloud platforms such as Azure, Google Cloud Platform (GCP), and Amazon Web Services (AWS). Vendor and Tool Management: Experience in overseeing and engaging with security service providers, as well as implementing and optimizing security tools. Standards and Frameworks: Proven experience in implementing and managing security programs based on industry standards and frameworks such as ISO 27001, NIST 800-53, and CIS benchmarks. Regulatory Knowledge: Familiarity with regulatory requirements such as PCI DSS 3.2.1 and CCPA/CPRA is preferred. Communication Skills: Exceptional presentation skills with the ability to articulate complex security concepts to senior leadership and business stakeholders, driving informed decision-making. Passion and Industry Fit: Strong enthusiasm for information security and a keen interest in contributing to the luxury retail sector, demonstrating an understanding of its unique challenges and opportunities. Position Logistics: Partially Remote: Role requires a minimum of 3 days in-person office presence in the New York and/or Piscataway, New Jersey office Bachelor’s degree in Computer Science, Information Technology, or a related field. Relevant security certifications (e.g., CISSP, OSCP, CISM, CISA, CEH) are highly desirable. *Chanel, Inc. reserves the right to edit, change, or make exceptions on designations where circumstances where deemed appropriate. Compensation: The anticipated base salary range for this position is $133,900 - $190,000. Base salary is one component of the total compensation for this position. Other forms of variable pay [may/will] be offered for this position. Other components [may/will] include bonus potential, benefits, and/or perks. Benefits and Perks: Wellbeing resources include dedicated paid time off for wellbeing (2-week August Office Closure) and a Wellbeing fund Family and care giving benefits (inclusive of parental leave, fertility support, MilkStork, and Care.com Membership) Generous paid time off policies to include vacation, holiday, sick and volunteer days 401K and other incentives Robust healthcare offerings; medical, dental, vision, MDLIVE (virtual care), One Medical, Flexible Spending Accounts (Health Care & Dependent Care), Health Savings Account and Employee Assistance Program Life insurance, Accidental Death & Dismemberment, Short Term Disability, Long Term Disability, Health Advocate, International Business Travel Accident & Medical, and Commuter Transit & Parking Additional Information: Chanel is a private company whose values are grounded in creating the conditions for people to perform at their best and feel fulfilled and confident in their work. We offer a unique work environment where individuals are encouraged to better understand the brand, the business, and motivations, so that together we can unlock the possibilities of growth. This is reflected in: Diversity and Inclusion: At CHANEL, we are intentional in promoting Diversity & Inclusion. We foster respect, empathy and dignity for all. We believe strongly that the diversity of our people across the full spectrum of human differences is essential to our organisation and the connections we have with each other and our clients. We offer Employee Resource Groups in the US that are voluntary, open to all, employee-led groups formed around a shared identity or lived experience, whose aim is to foster a diverse, inclusive, and equitable community aligned with the values and missions of the communities they support. Chanel Community: CHANEL Community empowers our employees to channel their passions, talents and sense of purpose to contribute to and learn from our communities. Employees are encouraged to take time off annually to volunteer through CHANEL Community. CHANEL also matches employee donations to select charitable organizations. Sustainability: CHANEL Mission 1.5° is our climate action plan. It is focused on transforming the business in line with the ambitions of the Paris Agreement on climate change to limit the average global mean temperature increase to 1.5 degrees Celsius above preindustrial levels. Employees are encouraged to contribute to our US Sustainability efforts at the corporate level and within the divisions, through organized taskforces and initiatives. Arts and Culture: We are committed to extending our legacy of cultural engagement. Global support includes the CHANEL Culture Fund, which supports a select group of leading art culture institutions across the globe, and the CHANEL Next Prize for the next generation of creative talent. US support currently includes Annual sponsorship of the MoMA film program, Tribeca Film Festival programs and Through Her Lens, Support of the Academy Gold Fellowship for Women and Sponsorship of the BAAND Together Dance Festival at Lincoln Center. Fondation Chanel: Since 2011, Fondation CHANEL’s mission is for women and girls to be free to shape their own destiny. Through multi-year partnerships with financial and technical support, Fondation CHANEL is committed to improving the safety and autonomy of women and adolescent girls around the world, impacting over a million women and girls in its first 10 years. For more information, please navigate to the Fondation Chanel website here Career and Leadership Development: We have dedicated in-house teams focused on supporting the onboarding of employees, developing leadership skills via custom programs like Imagine Chanel People, Heart of Leadership and group and individual coaching, and blended online and live classes offered on our Bloom platform and by skilled trainers, such as Shape Your Career, to develop career building skills. *Chanel, Inc. benefits and perks are dependent on eligibility and subject to modification by Chanel at any time. Chanel is a world leader in creating, manufacturing and distributing luxury products, including Ready-to-Wear, Accessories, Fragrances, Makeup, Skincare, Jewellery and Watches. Founded by Gabrielle Chanel in 1910, the House remains dedicated to quality craftsmanship and offering high-end creations. At present, Chanel employs more than 32,000 people worldwide. As an independent company, its core values are grounded in: Exceptional creation and client experience Nurturing human potential Having a positive impact – on people, the environment and communities around the world. As part of this, the House promotes arts, culture and creativity, while investing significantly in key areas including research & development, sustainability, and innovation. Chanel is dedicated to creating the conditions for people to perform at their best, building on their strengths and enabling them to benefit from new opportunities. It offers a unique working environment where people are given time to understand the brand, the business, and develop their personal motivations. This means everyone can grow, continue to be inspired and feel included, now and in the future. The company fosters true collaboration and respect for all, grounded in the belief that diversity is essential to the success of the organisation and its people. Chanel remains committed to rewarding people competitively, as well as offering initiatives such as wellbeing programmes, learning and development opportunities, and parental leave for all parents globally.'}"
825673156,Cyber Security Engineer,CACI International Inc,,2024-09-06T00:00:00+00:00,,"[{'@type': 'Place', 'address': {'@type': 'PostalAddress', 'addressCountry': 'United States of America', 'addressLocality': '0AU HAMPTON VA (LANGLEY AIR FORCE BASE)'}}]",['United States'],,,,['FULL_TIME'],https://caci.wd1.myworkdayjobs.com/External/job/US-VA-Hampton/Cyber-Security-Engineer_301465-2,workday,"{'text': ""Cyber Security Engineer Job Category: Information Technology Time Type: Full time Minimum Clearance Required to Start: TS/SCI Employee Type: Regular Percentage of Travel Required: Up to 10% Type of Travel: Continental US * * * CACI is seeking a Cyber Security Engineer to support our ODIN customer. We are looking for a cyber professional with experience with the RMF process, NIST guidelines, performing risk and security assessments, and implementing security controls to reduce risk and achieve business objectives. What You’ll Get to Do: Working collaboratively with other ISSOs and key stakeholders to the RMF process. Creating and managing RMF artifacts and the entire ATO lifecycle. Coordinating with Cybersecurity SMEs to identify requirements and process improvements. Assisting cybersecurity assessors as required. Interpreting DISA STIG requirements. Acts as a member of a team, supporting teammates and collaborating with a “do what it takes” attitude to ensure product and team success. Hands on approach to performing your own assessments with enclave and network infrastructure devices. Working with AWS and Azure environments. Ensuring product quality and timeliness of work, providing advice and guidance, resolving problems to meet objectives, and providing periodic performance reports. Provide input on best practices and procedures. Developing new and refining existing processes to enhance quality and productivity. You'll Bring These Qualifications: Active DOD Secret security clearance. College degree (B.S.) in Computer Science, Software Engineering, Information Management Systems or a related discipline. Equivalent professional experience will be considered in lieu of degree. 8+ years of prior experience related to Cloud ATO RMF processes, including inheritance models. Fortify software scanning experience. DOD 8570 certification at IAT Level 2 (CCNA Security, CySA+ {formerly CSA+}, GICSP, GSEC, Security+ CE, or SSCP). Must have solid RMF experience for the entire lifecycle. Must be able to create and maintain your own Cyber artifacts. Knowledge of cybersecurity concepts and tools including DISA STIGs, SCAP, SCC Tool, eMASS, ACAS. Familiarity with any of the following: FEDRAMP, DISA APL, Reciprocity, DevSecOps. Ability to innovate with cutting edge tools and technologies. Highly responsible, team-oriented individual with very strong work ethic and a self-starter. Excellent written and verbal communication skills. Strong collaboration skills and desire to work within a team. Highly responsible, team-oriented individual with very strong work ethic and self-starter. These Qualifications Would Be Nice to Have: Ability to apply principles, theories, and concepts, and contribute to the development of innovative principles and ideas. Familiarity with RMF 2.0 and Continuous ATO. Familiarity with Docker containers and Kubernetes container orchestration system for Docker containers. Familiarity with secure software development concepts. Familiarity with Security Engineering principles. - _____________________________________________________________________________ What You Can Expect: A culture of integrity. At CACI, we place character and innovation at the center of everything we do. As a valued team member, you’ll be part of a high-performing group dedicated to our customer’s missions and driven by a higher purpose – to ensure the safety of our nation. An environment of trust. CACI takes pride in fostering a diverse and accessible culture where every individual feels supported to chart their own path. You’ll have the autonomy to take the time you need through a unique flexible time off benefit and have access to robust learning resources to make your ambitions a reality. A focus on continuous growth. Together, we will advance our nation's most critical missions, build on our lengthy track record of business success, and find opportunities to break new ground — in your career and in our legacy. Your potential is limitless. So is ours. Learn more about CACI here. _____________________________________________________________________________ Pay Range: There are a host of factors that can influence final salary including, but not limited to, geographic location, Federal Government contract labor categories and contract wage rates, relevant prior work experience, specific skills and competencies, education, and certifications. Our employees value the flexibility at CACI that allows them to balance quality work and their personal lives. We offer competitive compensation, benefits and learning and development opportunities. Our broad and competitive mix of benefits options is designed to support and protect employees and their families. At CACI, you will receive comprehensive benefits such as; healthcare, wellness, financial, retirement, family support, continuing education, and time off benefits. Learn more here. Since this position can be worked in more than one location, the range shown is the national average for the position. The proposed salary range for this position is: $82,100-$172,400 CACI is an Equal Opportunity/Affirmative Action Employer. All qualified applicants will receive consideration for employment without regard to race, color, religion, sex, pregnancy, sexual orientation, gender identity, age, national origin, disability, status as a protected veteran, or any other protected characteristic. Advance the future of national security while working at the intersection of technology, government, and defense. For more than six decades, CACI has been pioneering ground-breaking solutions and helping our customers harness emerging technologies. CACI offers boundless career opportunities for employees to support their country, grow their skills, and expand their horizons.""}"
815689744,"Cyber Security Engineer, Principal",Manta Technologies Inc.,,2024-09-05T00:00:00+00:00,,"[{'@type': 'Place', 'address': {'@type': 'PostalAddress', 'addressCountry': 'United States of America', 'addressLocality': '201BF - Customer Site, Chantilly, VA'}}]",['United States'],,,,['FULL_TIME'],https://mantech.wd1.myworkdayjobs.com/External/job/USA-VA-Chantilly/Cyber-Security-Engineer--Principal_R54818-1,workday,"{'text': ""Secure our Nation, Ignite your Future Currently, ManTech is seeking a motivated, career and customer-oriented Cyber Security Engineer to join our team in the Chantilly, VA, area. Responsibilities: Design, implement and maintain complex systems and infrastructure that support business objectives Deploys solutions to proactively mitigate cyber threats to customer networks Collaborate with cross-functional teams to ensure that our systems and infrastructure meet security, scalability, and performance requirements Troubleshoot and resolve complex system issues, including performance and availability problems Makes recommendations to improve overall security posture to senior management Plan and execute system upgrades, patches, and migrations Develop and maintain disaster recovery plans and procedures Develop and implement system monitoring and alerting strategies Mentor and train junior team members Stay up-to-date with emerging technologies and industry trends Familiar with IC, DoD, and NIST Risk Management Framework directives and guidelines and security accreditation processes Assesses the performance of security controls within IT projects Evaluates potential system security risks and takes appropriate corrective, mitigation, and recovery actions Researches, evaluates, and provides feedback on problematic security trends and patterns in customer support requirements Basic Qualifications: Typically requires a Bachelor’s degree or equivalent in the fields of mathematics, telecommunications, electrical engineering, computer engineering, or computer science and 7+ years related experience. Strong IT system and application engineering background Excellent verbal and written communication skills are required. Ability to function in a fast-paced environment and effectively manage multiple tasks simultaneously; coordinating resources and ensuring scheduled goals are met. Experience with certification testing, Risk Management Framework (RMF), information assurance tools, DoD STIG, and vulnerability assessment Experience with VMWare infrastructure. vCenter and ESXi configuration and maintenance. Experience with one or more scripting languages (e.g., Python, JavaScript, Perl) Experience and knowledge of network devices (routers and switches), TCP/UDP traffic, firewall technologies, IDS technologies, proxy technologies, and antivirus, spam and spyware solutions. Familiarity with Elastic to include Logstash and Kibana concepts DoD 8570 certification meeting IAT Level II required Capable of travel to customer sites (CONUS and OCONUS) if needed Experience with modern Windows, LINUX, network operating systems, databases, and virtual computing to include command line configurations. Knowledge of IDS - intrusion detection solutions Knowledge with implementation of counter-measures or mitigating controls. Understanding of latest security principles, techniques, and protocols. Must be able to multi-task, work independently and as part of a team, share workloads, and deal with sudden shifts in project priorities. Security Clearance Requirements: Must have a current/active TS/SCI w/Poly Physical Requirements: Constantly operates a computer and other office productivity machinery, such as a calculator, copy machine and computer printer For all positions requiring access to technology/software source code that is subject to export control laws, employment with the company is contingent on either verifying U.S.-person status or obtaining any necessary license. The applicant will be required to answer certain questions for export control purposes, and that information will be reviewed by compliance personnel to ensure compliance with federal law. ManTech may choose not to apply for a license for such individuals whose access to export-controlled technology or software source code may require authorization and may decline to proceed with an applicant on that basis alone. ManTech International Corporation, as well as its subsidiaries proactively fulfills its role as an equal opportunity employer. We do not discriminate against any employee or applicant for employment because of race, color, sex, religion, age, sexual orientation, gender identity and expression, national origin, marital status, physical or mental disability, status as a Disabled Veteran, Recently Separated Veteran, Active Duty Wartime or Campaign Badge Veteran, Armed Forces Services Medal, or any other characteristic protected by law. If you require a reasonable accommodation to apply for a position with ManTech through its online applicant system, please contact ManTech's Corporate EEO Department at (703) 218-6000. ManTech is an affirmative action/equal opportunity employer - minorities, females, disabled and protected veterans are urged to apply. ManTech's utilization of any external recruitment or job placement agency is predicated upon its full compliance with our equal opportunity/affirmative action policies. ManTech does not accept resumes from unsolicited recruiting firms. We pay no fees for unsolicited services. If you are a qualified individual with a disability or a disabled veteran, you have the right to request an accommodation if you are unable or limited in your ability to use or access http://www.mantech.com/careers/Pages/careers.aspx as a result of your disability. To request an accommodation please click careers@mantech.com and provide your name and contact information. Why ManTech? This is why! When you apply for a job at ManTech, you are taking the first step toward a new adventure. Trailblazing technology, incredible professional development and the opportunity to serve our nation. All while Securing the Future®. ManTech provides mission-focused technology solutions and services for U.S. defense, intelligence and federal civilian agencies. In business for more than 52 years, we excel in full-spectrum cyber, data collection & analytics, enterprise IT, and systems and software engineering solutions that support national and homeland security. More than 9,300 talented professionals around the globe make up the ManTech family and nearly half are veterans. As a ManTech employee, you will work for a winning team alongside colleagues that support and inspire you. You will also have access to tuition assistance, partnerships with universities and institutions, professional groups that comprise our Communities of Practice, community service opportunities, Technical Recognition Awards, Career Enablement/Mobility programs and so much more. What are you waiting for? Click “Apply” and start your adventure today.""}"
