id,title,organization,orglogo,dateposted,datevalidthrough,locations_raw,locations_derived,locationtype,locationrequirements_raw,salary_raw,employmenttype,url,source,description
836782549,Cyber Security Subject Matter Expert - (REF1680K),Citizant,,2024-09-10T22:41:43.68+00:00,,"[{'address': {'streetAddress': '1131 Chapel Crossing Road', 'addressLocality': 'Brunswick', 'addressRegion': 'Georgia', 'postalCode': '31525', 'addressCountry': 'United States'}}]","['Brunswick, Georgia, United States']",,,,['Full-time'],https://jobs.smartrecruiters.com/Citizant/744000013008815-cyber-security-subject-matter-expert-ref1680k-,smartrecruiters,"{'text': ""Company DescriptionCitizant is a leading provider of professional IT services to the U.S. government. We seek to address some of our country’s most pressing challenges in the areas of Agile application development, Enterprise Data Management, Enterprise Architecture, Product Management, and Program Management support services. We strive to hire only ethical, talented, passionate and committed “A Players” who already align with the company’s core values: Drive, Delivering Excellence, Reputation, Responsibility, and a Better Future. No matter how large we grow, Citizant will retain its collaborative, supportive, small-company culture, where successful team effort to address external and internal customer challenges is valued above all else.Job DescriptionThe expected pay range for this position is\xa0$160,000 to\xa0$175,000 yearly. \xa0The exact pay rate will vary based on skills, experience, and location.\xa0Job Overview:Citizant is seeking a Cyber Security Subject Matter Expert (SME) to join our team. This is an onsite position in Glynco, Georgia. The role focuses on developing, implementing, and managing comprehensive cybersecurity strategies and solutions to protect the customers systems. The ideal candidate will have extensive experience in cybersecurity, particularly in identifying and mitigating threats and vulnerabilities within cloud environments.Duties & Responsibilities: Develop, implement, and manage comprehensive cybersecurity strategies and solutions to protect Citizant's and client systems, focusing on identifying and mitigating potential threats and vulnerabilities.Conduct security assessments, penetration tests, and vulnerability analyses to ensure compliance with industry standards and best practices, particularly within cloud environments.Provide expert guidance on security protocols, tools, and technologies, ensuring the highest level of protection for systems and data across various platforms, including cloud infrastructures.Lead incident response efforts, ensuring swift identification, containment, and resolution of cybersecurity incidents.Collaborate with cross-functional teams to design and enforce security policies and protocols, maintaining alignment with federal cybersecurity standards.Stay current with the latest cybersecurity threats, trends, and technologies, providing recommendations for continuous improvement of security measures.Contribute to the development of disaster recovery and business continuity plans with a strong focus on security.QualificationsRequired Skillset:7 to 10 years of experience in cybersecurity engineering or a related role, with a proven track record of managing complex security environments.Advanced knowledge of cybersecurity principles, practices, and technologies, with a focus on cloud security and penetration testing.Strong analytical and problem-solving skills, with the ability to quickly adapt to new threats and changes in the cybersecurity landscape.Proficiency in conducting vulnerability assessments, penetration tests, and security audits, with a solid understanding of both offensive and defensive security strategies.Excellent communication skills, capable of effectively articulating complex cybersecurity concepts to both technical and non-technical stakeholders.Ability to lead and collaborate with cross-functional teams in high-pressure environments, ensuring the successful implementation of security initiatives.Detail-oriented and meticulous in the design, implementation, and management of security systems and protocols.Education:Bachelor’s degree in Cybersecurity, Information Technology, Computer Science, or a related field. (Master’s degree preferred)Certified Information Systems Security Professional (CISSP) (required)Certified Ethical Hacker (CEH) (required)CompTIA Security+ (required)AWS Certified Security – Specialty or Microsoft Certified: Azure Security Engineer Associate (one is required)Certified Information Security Manager (CISM) (preferred)Certified Information Systems Auditor (CISA) (preferred)Offensive Security Certified Professional (OSCP) (preferred)Certified Red Team Professional (CRTP) (preferred)Certified Expert Penetration Tester (CEPT) (preferred)Clearance Requirements:U.S. Citizenship is requiredMust have an ACTIVE public trust or the ability to obtain oneAdditional InformationCitizant strives to be an employer of choice in the Washington metropolitan area. Citizant associates accept challenging and rewarding work and in return receive excellent compensation and benefits, as well as the opportunity for personal and professional development.\xa0Citizant is an Equal Opportunity Employer. All qualified applicants will receive consideration for employment without regard to race, color, religion, sex, pregnancy, sexual orientation, gender identity, national origin, age, protected veteran status, or disability status.""}"
836597820,Cyber Security Analyst I,Navy Federal Credit Union,https://www.navyfederal.org/content/dam/logos/nfcu/png/nfcu-nofom.png,2024-09-10T20:10:22+00:00,2024-09-18T03:59:22+00:00,"[{'@type': 'Place', 'address': {'@type': 'PostalAddress', 'addressLocality': 'Pensacola', 'addressRegion': 'FL', 'addressCountry': 'United States'}}]","['Pensacola, Florida, United States']",,,,['Full time'],https://fa-etbx-saasfaprod1.fa.ocs.oraclecloud.com/hcmUI/CandidateExperience/en/sites/CX_1001/job/20947,oraclecloud,"{'text': 'To monitor security tools and systems, and provides first tier response to cyber security incidents in a 24/7/365 Cyber Security Operations Center. Ensure adherence to standard operating procedures for detecting, classifying, and reporting incidents. Works under minimal supervision.'}"
835686012,Cyber Security Subject Matter Expert - (REF1680K),Citizant,,2024-09-10T15:56:23.504+00:00,,"[{'address': {'streetAddress': '1131 Chapel Crossing Road', 'addressLocality': 'Brunswick', 'addressRegion': 'Georgia', 'postalCode': '31525', 'addressCountry': 'United States'}}]","['Brunswick, Georgia, United States']",,,,['Full-time'],https://jobs.smartrecruiters.com/Citizant/744000012935457-cyber-security-subject-matter-expert-ref1680k-,smartrecruiters,"{'text': ""Company DescriptionCitizant is a leading provider of professional IT services to the U.S. government. We seek to address some of our country’s most pressing challenges in the areas of Agile application development, Enterprise Data Management, Enterprise Architecture, Product Management, and Program Management support services. We strive to hire only ethical, talented, passionate and committed “A Players” who already align with the company’s core values: Drive, Delivering Excellence, Reputation, Responsibility, and a Better Future. No matter how large we grow, Citizant will retain its collaborative, supportive, small-company culture, where successful team effort to address external and internal customer challenges is valued above all else.Job DescriptionJob Overview:Citizant is seeking a Cyber Security Subject Matter Expert (SME) to join our team. This is an onsite position in Glynco, Georgia. The role focuses on developing, implementing, and managing comprehensive cybersecurity strategies and solutions to protect the customers systems. The ideal candidate will have extensive experience in cybersecurity, particularly in identifying and mitigating threats and vulnerabilities within cloud environments.Duties & Responsibilities: Develop, implement, and manage comprehensive cybersecurity strategies and solutions to protect Citizant's and client systems, focusing on identifying and mitigating potential threats and vulnerabilities.Conduct security assessments, penetration tests, and vulnerability analyses to ensure compliance with industry standards and best practices, particularly within cloud environments.Provide expert guidance on security protocols, tools, and technologies, ensuring the highest level of protection for systems and data across various platforms, including cloud infrastructures.Lead incident response efforts, ensuring swift identification, containment, and resolution of cybersecurity incidents.Collaborate with cross-functional teams to design and enforce security policies and protocols, maintaining alignment with federal cybersecurity standards.Stay current with the latest cybersecurity threats, trends, and technologies, providing recommendations for continuous improvement of security measures.Contribute to the development of disaster recovery and business continuity plans with a strong focus on security.QualificationsRequired Skillset:7 to 10 years of experience in cybersecurity engineering or a related role, with a proven track record of managing complex security environments.Advanced knowledge of cybersecurity principles, practices, and technologies, with a focus on cloud security and penetration testing.Strong analytical and problem-solving skills, with the ability to quickly adapt to new threats and changes in the cybersecurity landscape.Proficiency in conducting vulnerability assessments, penetration tests, and security audits, with a solid understanding of both offensive and defensive security strategies.Excellent communication skills, capable of effectively articulating complex cybersecurity concepts to both technical and non-technical stakeholders.Ability to lead and collaborate with cross-functional teams in high-pressure environments, ensuring the successful implementation of security initiatives.Detail-oriented and meticulous in the design, implementation, and management of security systems and protocols.Education:Bachelor’s degree in Cybersecurity, Information Technology, Computer Science, or a related field. (Master’s degree preferred)Certified Information Systems Security Professional (CISSP) (required)Certified Ethical Hacker (CEH) (required)CompTIA Security+ (required)AWS Certified Security – Specialty or Microsoft Certified: Azure Security Engineer Associate (one is required)Certified Information Security Manager (CISM) (preferred)Certified Information Systems Auditor (CISA) (preferred)Offensive Security Certified Professional (OSCP) (preferred)Certified Red Team Professional (CRTP) (preferred)Certified Expert Penetration Tester (CEPT) (preferred)Clearance Requirements:U.S. Citizenship is requiredMust have an ACTIVE public trust or the ability to obtain oneAdditional InformationCitizant strives to be an employer of choice in the Washington metropolitan area. Citizant associates accept challenging and rewarding work and in return receive excellent compensation and benefits, as well as the opportunity for personal and professional development.\xa0Citizant is an Equal Opportunity Employer. All qualified applicants will receive consideration for employment without regard to race, color, religion, sex, pregnancy, sexual orientation, gender identity, national origin, age, protected veteran status, or disability status.""}"
835370176,"Cyber Security Engineer - Onsite - Firewalls, Vuln Management, Pentesting - 5 years experience minimum","Akicita Federal, LLC",https://lever-client-logos.s3.us-west-2.amazonaws.com/368b0303-3ba9-4170-afa1-e295c87e28df-1715949096503.png,2024-09-10T00:00:00+00:00,,"[{'@type': 'Place', 'address': {'@type': 'PostalAddress', 'addressLocality': 'Washington DC', 'addressRegion': None, 'addressCountry': None, 'postalCode': None}}]","['Washington, District of Columbia, United States']",,,,,https://jobs.lever.co/akicita-cyber/576141a4-4857-4509-9ef0-c7b743397402,lever.co,"{'text': ""This position is onsite. MUST HAVE 5 Years experience minimum.\n\\n\n\n\\n\n$120,000 - $150,000 a year\nJob Description:\nWe are seeking an experienced IT Infrastructure Engineer to join our dynamic team. The ideal candidate will provide comprehensive technical and engineering support for various IT infrastructure projects, including upgrades, enhancements, additions, and redesigns, with a strong focus on security and compliance. This role is critical in maintaining and improving our organization's security posture and operational efficiency.\n\nKey Responsibilities:\n-Provide engineering and administration support for security components such as firewalls, data loss prevention software, security tools (e.g., Qualys, Tenable Nessus, Splunk, CrowdStrike), content filtering, anti-spam software, and multifactor authentication devices.\n-Vulnerability Management / Some basic Penetration Testing\n-Ensure network infrastructure devices are configured in line with enterprise security standards.Conduct periodic internal security audits for compliance with established baselines.\n-Monitor network security logs to identify potential security violations and follow defined response procedures.\n-Respond to escalated incident reports and troubleshoot network security issues in line with SLAs.\n-Track deployment and manage inventory of network security devices.\n-Utilize tool sets to detect unauthorized network activity, coordinating with security offices and reporting incidents as necessary.\n-Standardize and centralize reporting and logging for cybersecurity initiatives.\n-Ensure compliance with OMB, DISA, US-CERT, NIST standards, and applicable information security laws and mandates.Provide support for FISMA, OIG audits, including data gathering and meetings.\n-Maintain NIST 800 series compliance in Infrastructure Engineering and Operations environments.\n-Perform security requirements analysis, architecture design, operations, and incident reporting.\n-Coordinate with vendors and third-party maintenance providers for network security device support.\n-Document and maintain standard security configurations for network/security devices.\n-Manage network device firmware and software updates, assessing implementation impacts.\n-Handle support maintenance contracts and provide renewal quotes in a timely manner.\n-Monitor and document performance trends of network security devices, recommending configuration changes as needed.\n-Support the CISO in responding to security incidents and establishing incident response teams.\n-Prepare Daily Security Reports and manage the Infrastructure Operations Patch Management program.\n-Ensure timely patching of infrastructure devices and draft Plan of Action and Milestones (POA&M) for unmitigated vulnerabilities.\n\nQualifications:\n-Bachelor’s degree in IT, Computer Science, or a related field.\n-Proven experience in IT infrastructure and network security.\n-Familiarity with security protocols, cybersecurity frameworks, and compliance standards.\n-Strong analytical, troubleshooting, and problem-solving skills.\n-Excellent communication and teamwork abilities.\n\\n""}"
836656484,Cyber Security Engineer- Security Awareness,HealthFirst,,2024-09-10T00:00:00+00:00,,"[{'@type': 'Place', 'address': {'@type': 'PostalAddress', 'addressCountry': 'United States of America', 'addressLocality': 'Remote - NC'}}]",['United States'],,,,['FULL_TIME'],https://healthfirst.wd1.myworkdayjobs.com/healthfirst/job/Remote---NC/Cyber-Security-Engineer--Security-Awarness_R018978,workday,"{'text': 'We are seeking a highly motivated and enthusiastic individual to join our Security Team. Candidate should have strong communication, problem solving, collaboration, and relationship building skills. You will have the opportunity to continue building out the Healthfirst security awareness training program. Responsibilities: Develop learning and awareness programs to cultivate a culture of security awareness. Ensure Healthfirst’s security awareness program meets industry regulations, standards, and compliance requirements, as well as, communicates our security polices and requirements, so that employees know, understand, and can follow them. Identify the top human risks to Healthfirst and the behaviors we need to change to mitigate that risk. Develop and maintain a security awareness program that supports changing these risky behaviors ensuring HF employees act in a secure manner to help reduce risk to the organization. Stay informed about the latest cybersecurity threats and industry best practices. Minimum Qualifications: High School Diploma or GED from an accredited institution Basic understanding of cybersecurity concepts and principles. Have a basic understanding of the different concepts of information security. Understand the concept of information security/human risks and the different elements and determine how to mitigate identified risks. Work closely with leadership across the organization to understand security challenges and tailor training to meet business and compliance requirements Ability to develop comprehensive security awareness campaigns to ensure the organization is informed of current security risks and how they should avoid falling victim. Strong analytical and problem-solving skills. Excellent communication and collaboration skills. Ability to work independently and as part of a team. Eagerness to learn and contribute to the success of the Security team. Preferred Qualifications Basic Security Awareness knowledge and experience giving training to non-security personnel. Knowledge of KnowBe4 and LivingSecurity security awareness platforms. Ability to form complex communications/messages in a simple, clear, and concise manner to target various departments cross Healthfirst. Project management experience to help in planning, managing, and maintaining a complex, organization wide program. Experience providing information security support and/or solutions IT engineering or Security Engineering experience WE ARE AN EQUAL OPPORTUNITY EMPLOYER. Applicants and employees are considered for positions and are evaluated without regard to race, color, religion, gender, gender identity, sexual orientation, national origin, age, genetic information, military or veteran status, marital status, mental or physical disability or any other protected Federal, State/Province or Local status unrelated to the performance of the work involved. If you have a disability under the Americans with Disability Act or a similar law and want a reasonable accommodation to assist with your job search or application for employment, please contact us by sending an email to careers@Healthfirst.org or calling 212-519-1798 . In your email please include a description of the accommodation you are requesting and a description of the position for which you are applying. Only reasonable accommodation requests related to applying for a position within Healthfirst Management Services will be reviewed at the e-mail address and phone number supplied. Thank you for considering a career with Healthfirst Management Services. EEO Law Poster and Supplement All hiring and recruitment at Healthfirst is transacted with a valid “@healthfirst.org” email address only or from a recruitment firm representing our Company. Any recruitment firm representing Healthfirst will readily provide you with the name and contact information of the recruiting professional representing the opportunity you are inquiring about. If you receive a communication from a sender whose domain is not @healthfirst.org, or not one of our recruitment partners, please be aware that those communications are not coming from or authorized by Healthfirst. Healthfirst will never ask you for money during the recruitment or onboarding process. Hiring Range*: Greater New York City Area (NY, NJ, CT residents): $106,300 - $153,595 All Other Locations (within approved locations): $97,000 - $144,330 As a candidate for this position, your salary and related elements of compensation will be contingent upon your work experience, education, licenses and certifications, and any other factors Healthfirst deems pertinent to the hiring decision. In addition to your salary, Healthfirst offers employees a full range of benefits such as, medical, dental and vision coverage, incentive and recognition programs, life insurance, and 401k contributions (all benefits are subject to eligibility requirements). Healthfirst believes in providing a competitive compensation and benefits package wherever its employees work and live. *The hiring range is defined as the lowest and highest salaries that Healthfirst in “good faith” would pay to a new hire, or for a job promotion, or transfer into this role. Healthfirst is New York’s largest not-for-profit health insurer offering it’s nearly 1.7 million members access to high-quality, affordable healthcare. As part of the community for nearly 30 years, Healthfirst’s unique advantage is rooted in its belief that good health doesn’t start in a doctor’s office. The company’s mission is to put its members first by working closely with care providers and community leaders to address broader issues that can impact health and well-being. This value-based care model is the foundation of the company’s sustained growth in one of the most dynamic markets in the country. So, if you are passionate about what you do and want to work for a company that is focused on the future and dedicated to making a difference in people’s lives, then Healthfirst is for you. Click here to navigate back to the career site!'}"
