id,title,organization,orglogo,dateposted,datevalidthrough,locations_raw,locations_derived,locationtype,locationrequirements_raw,salary_raw,employmenttype,url,source,description
815689701,"Cyber Security Engineer, Senior",Manta Technologies Inc.,,2024-09-04T00:00:00+00:00,,"[{'@type': 'Place', 'address': {'@type': 'PostalAddress', 'addressCountry': 'United States of America', 'addressLocality': '201BF - Customer Site, Chantilly, VA'}}]",['United States'],,,,['FULL_TIME'],https://mantech.wd1.myworkdayjobs.com/External/job/USA-VA-Chantilly/Cyber-Security-Engineer--Senior_R54856,workday,"{'text': ""Secure our Nation, Ignite your Future Seeking a motivated, career and customer-oriented Cyber Security Engineer, Senior to join our team in the Chantilly, VA, area. Become an integral part of a diverse team while working at an Industry Leading Organization, where our employees come first. At ManTech International Corporation, you’ll help protect our national security while working on innovative projects that offer opportunities for advancement. Responsibilities include, but are not limited to: Analyze and make recommendations for policies/procedures/processes in order to increase efficiencies and streamline project activities Interacts with other team members and customers at multiple levels to gather, supply, or coordinate information Good communication and customer service skills are needed along with ability to coordinate effectively with individuals from multiple levels Ensure compliance with all customers’ policies and procedures to include TASKORDs Ensure compliance with the enterprise service requirements to include CONOPS, account management, and system security plans Work closely with customers on onboarding, updates and troubleshooting issues with vulnerability scanning Provides customer support via phone, email, or messaging services to resolve issues and answer questions. This includes maintaining communication throughout the entire process, as necessary. Provides insight into efficiencies that can be gained from the current workflow based on an understanding of the customers’ requirements Provides ideas for and integrates automation of repetitive project tasks and metrics collection through the use of scripts and assists with testing/implementation to production Analyze customer feedback to assist in process improvement Performs engineering support and system administration of specialized cybersecurity applications and systems to include installation, configuration, maintenance, patching, and back-up/restore Basic Qualifications: 5+ years of technical experience with cyber tools. Minimum education: B.S. or 4+ additional years of experience The candidate should possess a working knowledge of Tenable product suite and vulnerability scanning A solid understanding of Windows and Linux systems administration, general operating system security practices, TCP/IP networking, and network security concepts is required The candidate should possess general understanding of ServiceNow Excellent organization, planning, and multi-tasking skills with attention to detail Must have or be able to obtain IAT Level II certifications within 6 months of hire Preferred Qualifications: Knowledge of and proficiency in the use of AWS technologies The candidate possesses general understanding of ServiceNow Understanding of federal Cyber Security Guidance such as NIST SP 800-37 – Guide for Applying the Risk Management Framework to Federal Information Systems and NIST 800-137 – Information Security Continuous Monitoring (ISCM) for Federal Information Systems and Organizations Ability to function in a fast-paced environment and effectively manage multiple tasks simultaneously; coordinating resources and ensuring scheduled goals are met Security Clearance Requirements: Must possess an active TS/SCI with polygraph Physical Requirements: Must be able to remain in a stationary position 50% Constantly operates a computer and other office productivity machinery, such as a calculator, copy machine and computer printer The person in this position frequently communicates with co-workers, management and customers, which may involve delivering presentations. Must be able to exchange accurate information in these situations Ability to work in a cubicle environment without distractions #GL-SOC For all positions requiring access to technology/software source code that is subject to export control laws, employment with the company is contingent on either verifying U.S.-person status or obtaining any necessary license. The applicant will be required to answer certain questions for export control purposes, and that information will be reviewed by compliance personnel to ensure compliance with federal law. ManTech may choose not to apply for a license for such individuals whose access to export-controlled technology or software source code may require authorization and may decline to proceed with an applicant on that basis alone. ManTech International Corporation, as well as its subsidiaries proactively fulfills its role as an equal opportunity employer. We do not discriminate against any employee or applicant for employment because of race, color, sex, religion, age, sexual orientation, gender identity and expression, national origin, marital status, physical or mental disability, status as a Disabled Veteran, Recently Separated Veteran, Active Duty Wartime or Campaign Badge Veteran, Armed Forces Services Medal, or any other characteristic protected by law. If you require a reasonable accommodation to apply for a position with ManTech through its online applicant system, please contact ManTech's Corporate EEO Department at (703) 218-6000. ManTech is an affirmative action/equal opportunity employer - minorities, females, disabled and protected veterans are urged to apply. ManTech's utilization of any external recruitment or job placement agency is predicated upon its full compliance with our equal opportunity/affirmative action policies. ManTech does not accept resumes from unsolicited recruiting firms. We pay no fees for unsolicited services. If you are a qualified individual with a disability or a disabled veteran, you have the right to request an accommodation if you are unable or limited in your ability to use or access http://www.mantech.com/careers/Pages/careers.aspx as a result of your disability. To request an accommodation please click careers@mantech.com and provide your name and contact information. Why ManTech? This is why! When you apply for a job at ManTech, you are taking the first step toward a new adventure. Trailblazing technology, incredible professional development and the opportunity to serve our nation. All while Securing the Future®. ManTech provides mission-focused technology solutions and services for U.S. defense, intelligence and federal civilian agencies. In business for more than 52 years, we excel in full-spectrum cyber, data collection & analytics, enterprise IT, and systems and software engineering solutions that support national and homeland security. More than 9,300 talented professionals around the globe make up the ManTech family and nearly half are veterans. As a ManTech employee, you will work for a winning team alongside colleagues that support and inspire you. You will also have access to tuition assistance, partnerships with universities and institutions, professional groups that comprise our Communities of Practice, community service opportunities, Technical Recognition Awards, Career Enablement/Mobility programs and so much more. What are you waiting for? Click “Apply” and start your adventure today.""}"
807818975,"Senior Cyber Security Engineer (SOC, GRC, CISM/CISSP)",TMS LLC,,2024-09-03T13:57:48.138+00:00,,"[{'address': {'addressLocality': 'Jersey City', 'addressRegion': 'New Jersey', 'addressCountry': 'United States'}}]","['Jersey City, New Jersey, United States']",,,,['Contract'],https://jobs.smartrecruiters.com/TMSLLC/744000011277803-senior-cyber-security-engineer-soc-grc-cism-cissp-,smartrecruiters,"{'text': 'Job DescriptionRole: Senior Cyber Security EngineerLocation: New Jersey (Day 1 Onsite)Duration: 6+ MonthsExperience Needed: 12+ Years\xa0Licensure, Registration, and Certifications are Mandatory and try to find someone who have past 2-3 Years of experience in Health Care:·\xa0\xa0\xa0\xa0\xa0\xa0\xa0Certified Information Security Manager (CISM) or Certified Information Systems Security Professional (CISSP) Certification.Job Description:\xa0Education Requirements:·\xa0\xa0\xa0\xa0\xa0\xa0\xa0Bachelor in Computer Science, Information Security, or a related field.·\xa0\xa0\xa0\xa0\xa0\xa0\xa0Minimum of 1-3 years of past experience in information security, especially in an analyst role on a Computer Incident Response Team (CIRT), Computer Emergency Response Team (CERT), Computer Security Incident Response Center (CSIRC) or a Security Operations Center (SOC).·\xa0\xa0\xa0\xa0\xa0\xa0\xa0Experience with any of the following systems/products also a plus: scripting, enterprise antivirus management, data loss prevention, malware detection, intrusion detection/prevention, penetration testing/vulnerability scanning, web application firewall.·\xa0\xa0\xa0\xa0\xa0\xa0\xa0Excellent written and verbal communication skills and effective problem-solving skills required.\xa0Licensure, Registration, and Certifications:·\xa0\xa0\xa0\xa0\xa0\xa0\xa0Certified Information Security Manager (CISM) or Certified Information Systems Security Professional (CISSP) Certification.\xa0Job Description·\xa0\xa0\xa0\xa0\xa0\xa0\xa0Provide first level response for security events including but not limited to intrusion detection, malware infections, denial of service attacks, privileged account misuse and network breaches.·\xa0\xa0\xa0\xa0\xa0\xa0\xa0Coordinate with enterprise-wide cyber defense staff to validate network alerts·\xa0\xa0\xa0\xa0\xa0\xa0\xa0Ensure cybersecurity-enabled products or other compensating security control technologies reduce identified risk to an acceptable level·\xa0\xa0\xa0\xa0\xa0\xa0\xa0Work with TVM vendor, work with various to to drive the remediation and track the process, Open CR and schedule scans & follow up scans, analyze potential exploitation scenarios, assess applicable security controls, and evaluate potential impact.·\xa0\xa0\xa0\xa0\xa0\xa0\xa0Performing security reviews and identify security gaps in security architecture resulting in recommendations for inclusion in the risk mitigation strategy·\xa0\xa0\xa0\xa0\xa0\xa0\xa0Participating in planning and recommendation of modifications or adjustments based on exercise results or system environment.·\xa0\xa0\xa0\xa0\xa0\xa0\xa0Implementing security measures assistance in disaster recovery and planning.·\xa0\xa0\xa0\xa0\xa0\xa0\xa0Utilizing OSINT to effectively detect and prevent indicators of compromise in affected systems.·\xa0\xa0\xa0\xa0\xa0\xa0\xa0Triaging according to organizational procedures to ensure that a genuine security incident is occurring.·\xa0\xa0\xa0\xa0\xa0\xa0\xa0Providing daily summary reports of network events and activity relevant to cyber defense practices·\xa0\xa0\xa0\xa0\xa0\xa0\xa0Providing timely detection, identification, and alerting of possible attacks/intrusions, anomalous activities, and misuse activities and distinguish these incidents and events from benign activities.·\xa0\xa0\xa0\xa0\xa0\xa0\xa0Conducting research, analysis, and correlation across a wide variety of all source data sets (indications and warnings).·\xa0\xa0\xa0\xa0\xa0\xa0\xa0Collaborating with stakeholders to resolve computer security incidents and vulnerability compliance.·\xa0\xa0\xa0\xa0\xa0\xa0\xa0Documenting and escalate incidents (including event’s history, status, and potential impact for further action) that may cause ongoing and immediate impact to the environment.·\xa0\xa0\xa0\xa0\xa0\xa0\xa0Analyzing identified malicious activity to determine weaknesses exploited, exploitation methods, effects on system and information.·\xa0\xa0\xa0\xa0\xa0\xa0\xa0Monitoring and reviewing the most recent SIEM alerts to determine relevance and urgency.·\xa0\xa0\xa0\xa0\xa0\xa0\xa0Providing metrics and reports around security monitoring by designing dashboards for asset owners and management consumption·\xa0\xa0\xa0\xa0\xa0\xa0\xa0Contributing to the development and implementation of security architecture, standards, procedures and guidelines for multiple platforms·\xa0\xa0\xa0\xa0\xa0\xa0\xa0Documenting current case notes sufficient for effective shift handover, as well as reviewing current status via phone call or in person.·\xa0\xa0\xa0\xa0\xa0\xa0\xa0Engaging in all forms of communications (e.g. phone calls, instant-messaging, web page updates) to ensure cases are efficiently investigated by all approved parties·\xa0\xa0\xa0\xa0\xa0\xa0\xa0Recommending new security tools to management and reports and provides guidance and expertise in their implementation.·\xa0\xa0\xa0\xa0\xa0\xa0\xa0Reviewing and analyzing complex data and information to provide insights, conclusions and actionable recommendations provides direction and guidance on reports and analyses and ensures recommendations are aligned with customer/business needs and capabilities.·\xa0\xa0\xa0\xa0\xa0\xa0\xa0Own and administratively manage all security tools and ensure it is monitored on a regular basis.Additional InformationThe final round will be in person.'}"
807719246,Summer Associate (Cyber Security Analyst),Navy Federal Credit Union,https://www.navyfederal.org/content/dam/logos/nfcu/png/nfcu-nofom.png,2024-09-03T04:00:00+00:00,2025-01-01T04:59:00+00:00,"[{'@type': 'Place', 'address': {'@type': 'PostalAddress', 'addressLocality': 'Vienna', 'addressRegion': 'VA', 'addressCountry': 'United States'}}]","['Vienna, Virginia, United States']",,,,['Full time'],https://fa-etbx-saasfaprod1.fa.ocs.oraclecloud.com/hcmUI/CandidateExperience/en/sites/CX_1001/job/20630,oraclecloud,"{'text': 'The Cyber Advanced Analysis Team (CAAT) in Navy Federal’s Information Security Division’s Automation and Special Projects group identifies, tracks and mitigates cyber threats to Navy Federal Credit Union Members. Systemic and persistent threats to Navy Federal Members include but are not limited to fraud schemes and identity theft. CAAT collaborates with additional teams across Navy Federal to innovate and automate protections against these threats. \nThe Summer Associate will conduct a three-month research experiment with the intent of presenting the results of the research at the end of the summer. \nPotential projects could include: \nConduct a retrospective research project into a subset of Navy Federal Members accounts who were victims of account takeover (ATO) with the intent of building a model to identify potential fraud losses averted by new controls which secure account credentials.\nInvestigate phishing sites targeting Navy Federal Members to identify and analyze the phish kits or other infrastructure commonalities across the sites.\nBuild a machine learning model to categorize or classify deep and dark web threats to Navy Federal Members.'}"
809939000,Cyber Security Analyst/Incident Response - Tier 3,DXC Technology,,2024-09-03T00:00:00+00:00,,"[{'@type': 'Place', 'address': {'@type': 'PostalAddress', 'addressCountry': 'United States of America', 'addressLocality': 'TW2DE - Teleworker/Offsite-USA-DE'}}]",['United States'],,,,['FULL_TIME'],https://dxctechnology.wd1.myworkdayjobs.com/DXCJobs/job/USA---DE---ANY-CITY/Cyber-Security-Analyst-Incident-Response----Tier-3_51516317,workday,"{'text': ""Job Description: DXC Technology (NYSE: DXC) helps global companies run their mission critical systems and operations while modernizing IT, optimizing data architectures, and ensuring security and scalability across public, private and hybrid clouds. The world’s largest companies and public sector organizations trust DXC to deploy services across the Enterprise Technology Stack to drive new levels of performance, competitiveness, and customer experience. Learn more about how we deliver excellence for our customers and colleagues at DXC.com. Our DXC Security services helps customers assess risk and proactively address all facets of their security environment, from threat intelligence to compliance. We leverage proven methodologies, intelligent automation and industry-leading partners to tailor security solutions to our customers' unique business needs. The Tier 3 Cyber Security Analyst/Incident Response position is a part of the Cyber Defense Center team. The CDC provides cyber security monitoring, reporting, and response for numerous external clients. Tier duties include, but are not limited to: Receive incident escalations from monitoring team and assist with real-time advanced analysis, response, and reporting. Mentor and assist in training Tier 1 and 2 analysts to aid in their skills development and analytical capabilities. Proactively hunt for threats and enacting identification, containment, and eradication measures while supporting recovery efforts. Point person for coordination with appropriate parties during a security incident – client, management, legal, security, operations, etc. Create thorough reports and documentation of all incidents and procedures, presenting findings to team and leadership on a routine basis Incident Response: remote remediation when possible and working with onsite teams when necessary. Detailed documentation of events and remediation steps taken. Root Cause Analysis: initiation and follow-through to ensure quality forensic materials are captured, writing reports with details and timelines of events with recommendations to avoid future occurrences Assist in the general maintenance and improvement of processes and/or playbooks. Conduct research regarding the latest methods, tools, and trends in digital forensics analysis Conduct analysis using logs, previous alerts, etc. to identify trends to identify and prevent potential incidents. Basic Qualifications Bachelor's degree or equivalent combination of education and experience Six or more years of experience in information systems security Good communication skills to interact with clients, team members, management, and support personnel Good analytical and problem-solving skills Ability to work independently and as part of a team, be highly self-motivated Experience working with computer desktop packages such as Microsoft Word, Excel, etc. To conform to U.S. Government space technology export regulations, including the International Traffic in Arms Regulations (ITAR) you must be a U.S. citizen, lawful permanent resident of the U.S., protected individual as defined by 8 U.S.C. 1324b(a)(3), or eligible to obtain the required authorizations from the U.S. Department of State. Preferred Qualifications Bachelor's degree or higher in information systems security, computer science, or related field CISSP, GCFA, or equivalent level certification relating to Cyber Security and/or Incident Response. Work Environment Requires being on-call during off hours May require occasional weekend work Remote Compensation at DXC is influenced by an array of factors, including but not limited to the experience, job-related knowledge, skills, competencies, as well as contract-specific affordability and organizational requirements. A reasonable estimate of the current compensation range for this position is $109,700 - $203,600. Full-time hires are eligible to participate in the DXC benefit program. DXC offers a comprehensive, flexible, and competitive benefits program which includes, but is not limited to, health, dental, and vision insurance coverage; employee wellness; life and disability insurance; a retirement savings plan, paid holidays, paid time off. If you are an applicant from the United States, Guam, or Puerto Rico DXC Technology is an Equal Opportunity/Affirmative Action employer. All qualified candidates will receive consideration for employment without regard to disability, protected veteran status, race, color, religious creed, national origin, citizenship, marital status, sex, sexual orientation/gender identity, age or genetic information. DXC's commitment to diversity and inclusive selection practices includes ensuring qualified long-term unemployed job seekers receive equal consideration for employment. View postings below. We participate in E-Verify. In addition to the posters already identified, DXC provides access to prospective employees for the Federal Minimum Wage Poster, Federal Polygraph Protection Act Poster as well as any state or locality specific applicant posters. To access the postings in the link below, select your state to view all applicable federal, state and locality postings. Postings are available in English, and in Spanish, where required. View postings below. Postings link Disability Accommodations If you are an individual with a disability, a disabled veteran, or a wounded warrior and you are unable or limited in your ability to access or use this site as a result of your disability, you may request a reasonable accommodation by contacting us via email. Please note: DXC will respond only to requests for accommodations due to a disability. Recruitment fraud is a scheme in which fictitious job opportunities are offered to job seekers typically through online services, such as false websites, or through unsolicited emails claiming to be from the company. These emails may request recipients to provide personal information or to make payments as part of their illegitimate recruiting process. DXC does not make offers of employment via social media networks and DXC never asks for any money or payments from applicants at any point in the recruitment process, nor ask a job seeker to purchase IT or other equipment on our behalf. More information on employment scams is available here. DXC Technology (NYSE: DXC) helps global companies run their mission critical systems and operations while modernizing IT, optimizing data architectures, and ensuring security and scalability across public, private and hybrid clouds. The world's largest companies and public sector organizations trust DXC to deploy services across the Enterprise Technology Stack to drive new levels of performance, competitiveness, and customer experience. Learn more about how we deliver excellence for our customers and colleagues at DXC.com.""}"
