id,title,organization,orglogo,dateposted,datevalidthrough,locations_raw,locations_derived,locationtype,locationrequirements_raw,salary_raw,employmenttype,url,source,description
795698216,Cyber Security Assurance Technician (Junior),CACI International Inc,,2024-08-30T00:00:00+00:00,,"[{'@type': 'Place', 'address': {'@type': 'PostalAddress', 'addressCountry': 'United States of America', 'addressLocality': 'AKZ ABERDEEN PROVING GROUND MD'}}]",['United States'],,,,['FULL_TIME'],https://caci.wd1.myworkdayjobs.com/External/job/US-MD-Aberdeen-Proving-Ground/Cyber-Security-Assurance-Technician--Junior-_301305-1,workday,"{'text': ""Cyber Security Assurance Technician (Junior) Job Category: Information Technology Time Type: Full time Minimum Clearance Required to Start: TS/SCI Employee Type: Regular Percentage of Travel Required: Up to 10% Type of Travel: Continental US * * * The Opportunity: CACI is seeking a Cyber Security Information Assurance Technician (Level I) with experience with managing, upgrading, securing, documenting a Linux and Microsoft based server/client development architecture in Aberdeen, MD. The ideal candidate will be responsible for sustaining the overall health and security of a Linux based development lab. Responsibilities: Documenting all software, firmware, hardware and network modifications Implement applicable patches including IA vulnerability alerts (IAVA), IA vulnerability bulletins (IAVB), and technical advisories (TA) for the CE operating system(s). Assist in the system security authorization processes. Assist in writing and developing System Security Plans (SSPs), Plan Of Actions and Milestones (POA&Ms), Risk Assessments, Privacy Impact Assessments (PIAs), and supporting documentation for systems subject to NIST SP 800-53. Perform IS security briefings, report all security incidents and investigate, document and report, as well as provide protective and corrective measures in response to such incidents. An understand/knowledge of Cybersecurity RMF Controls Validation Testing Qualifications: Required: AA/2-year degree in Computer Science, Information Systems, Engineering Technology, or related scientific or technical discipline with 3 years experience. AT Least 3 years administrating, securing, and maintaining Linux based systems Solid understanding of RedHat Linux Server computing environment, platforms/environments and vendor specific appliance support Solid understanding of a Windows server client computing environment, platforms/environments and vendor specific appliance support Knowledge of the Certification and Accreditation (C&A) and EMASS RMF processes Qualified at the IAT Level II for the DoD Information Assurance Workforce, must possess one of the following certifications: CISSP SEC+ CE, CySA+, GICSP, GSEC, or SSCP TS/SCI Desired: Technical Writing experience (creating/updating IA policy & procedure documentation) Excellent written and verbal communication skills with strong presentation abilities Must be able to work well on independent engagements as well as within a team setting Strong client presence and interaction abilities Some understanding of military hierarchy. REDHAT Certification Windows Server Certification Experience with classified removeable media control - _____________________________________________________________________________ What You Can Expect: A culture of integrity. At CACI, we place character and innovation at the center of everything we do. As a valued team member, you’ll be part of a high-performing group dedicated to our customer’s missions and driven by a higher purpose – to ensure the safety of our nation. An environment of trust. CACI takes pride in fostering a diverse and accessible culture where every individual feels supported to chart their own path. You’ll have the autonomy to take the time you need through a unique flexible time off benefit and have access to robust learning resources to make your ambitions a reality. A focus on continuous growth. Together, we will advance our nation's most critical missions, build on our lengthy track record of business success, and find opportunities to break new ground — in your career and in our legacy. Your potential is limitless. So is ours. Learn more about CACI here. _____________________________________________________________________________ Pay Range: There are a host of factors that can influence final salary including, but not limited to, geographic location, Federal Government contract labor categories and contract wage rates, relevant prior work experience, specific skills and competencies, education, and certifications. Our employees value the flexibility at CACI that allows them to balance quality work and their personal lives. We offer competitive compensation, benefits and learning and development opportunities. Our broad and competitive mix of benefits options is designed to support and protect employees and their families. At CACI, you will receive comprehensive benefits such as; healthcare, wellness, financial, retirement, family support, continuing education, and time off benefits. Learn more here. Since this position can be worked in more than one location, the range shown is the national average for the position. The proposed salary range for this position is: $48,300-$96,600 CACI is an Equal Opportunity/Affirmative Action Employer. All qualified applicants will receive consideration for employment without regard to race, color, religion, sex, pregnancy, sexual orientation, gender identity, age, national origin, disability, status as a protected veteran, or any other protected characteristic. Advance the future of national security while working at the intersection of technology, government, and defense. For more than six decades, CACI has been pioneering ground-breaking solutions and helping our customers harness emerging technologies. CACI offers boundless career opportunities for employees to support their country, grow their skills, and expand their horizons.""}"
790210498,Senior Cyber Security Engineer,Epiq,,2024-08-29T00:00:00+00:00,,"[{'@type': 'Place', 'address': {'@type': 'PostalAddress', 'addressCountry': 'United States of America', 'addressLocality': 'USA- New York Remote Office'}}]",['United States'],TELECOMMUTE,"[{'@type': 'Country', 'name': 'United States of America'}]",,['FULL_TIME'],https://epiqsystems.wd5.myworkdayjobs.com/Epiq_Careers/job/USA-New-York-NY-777-Third-Avenue/Senior-Cyber-Security-Engineer_R0029050,workday,"{'text': ""It's fun to work at a company where people truly believe in what they are doing! Job Description: Job Summary: We are seeking a highly skilled and experienced Senior Cybersecurity Engineer to focus on vulnerability management and attack surface management. This role will involve working closely with IT and business teams to identify and remediate vulnerabilities, monitoring threat intelligence sources for zero-day attacks, and driving the vulnerability response plan. The ideal candidate will have a strong background in cybersecurity, familiarity with popular vulnerability management tools, and experience with external attack surface vulnerabilities and monitoring tools. Job Responsibilities: Collaborate with IT and business teams to identify, assess, and remediate vulnerabilities. Consult with remediation owners to help them understand the vulnerabilities and possible mitigations. Monitor threat intelligence sources for zero-day attacks and adjust the vulnerability response plan accordingly. Conduct daily monitoring of the organization’s vulnerability and attack surface. Escalate identified vulnerabilities to the appropriate teams for remediation. Utilize various vulnerability management tools to conduct regular scans and assessments. Implement and manage external attack surface monitoring tools. Develop and maintain documentation related to vulnerability management processes and procedures. Provide regular reports and updates to senior management on the status of vulnerabilities and remediation efforts. Stay up to date with the latest cybersecurity trends, threats, and technologies. Job Requirements: 5+ years' work experience in computer systems with specialization in vulnerability and attack surface management. Understanding of tactics, techniques, and procedures of modern adversaries. Strong knowledge of popular vulnerability management tools (e.g., Nessus, Qualys, Rapid7). Experience with external attack surface monitoring tools (e.g., RiskIQ, CyCognito). Familiarity with AWS and Azure cloud environments. Familiarity with threat intelligence sources and zero-day attack monitoring. Excellent problem-solving skills and attention to detail. Excellent communication skills, both verbal and written. Must be a self-managed/self-driven individual. Relevant certifications include CompTIA: Security+, A+, CySA+, CASP; CEH; GIAC (SANS): GEVA Candidates based in California, Colorado, Hawaii, New York, Vermont, Washington or Washington, DC: The Compensation range for this role is 91,922.40 - 183,844.80 USD annually and may be eligible for an annual bonus. Actual compensation within that range will be dependent upon the individual's location, skills, experience and qualifications. Click here to learn about Epiq's Benefits. If you like wild growth and working with happy, enthusiastic over-achievers, you'll enjoy your career with us! It is Epiq’s policy to comply with all applicable equal employment opportunity laws by making all employment decisions without unlawful regard or consideration of any individual’s race, religion, ethnicity, color, sex, sexual orientation, gender identity or expressions, transgender status, sexual and other reproductive health decisions, marital status, age, national origin, genetic information, ancestry, citizenship, physical or mental disability, veteran or family status or any other basis protected by applicable national, federal, state, provincial or local law. Epiq’s policy prohibits unlawful discrimination based on any of these impermissible bases, as well as any bases or grounds protected by applicable law in each jurisdiction. In addition Epiq will take affirmative action for minorities, women, covered veterans and individuals with disabilities. If you need assistance or an accommodation during the application process because of a disability, it is available upon request. Epiq is pleased to provide such assistance and no applicant will be penalized as a result of such a request. Pursuant to relevant law, where applicable, Epiq will consider for employment qualified applicants with arrest and conviction records. Epiq is a leading global provider of integrated technology and services for the legal profession, including eDiscovery, managed services, bankruptcy, class action and mass tort administration, federal regulatory actions and data breach responses. Our innovative solutions are designed to streamline the administration of litigation, investigations, financial transactions, regulatory compliance and other legal matters. Epiq’s subject-matter experts bring clarity to complexity, create efficiency through expertise and deliver confidence to our clients around the world. We strive for a cohesive, collaborative environment that focuses on group achievement. With over 8000 associates worldwide, Epiq operates in 19 countries and over 80 global locations.""}"
791613847,"Comcast Cybersecurity: Engineer 4, Cyber Security Engineering - Identity and Access Management",Comcast,,2024-08-29T00:00:00+00:00,,"[{'@type': 'Place', 'address': {'@type': 'PostalAddress', 'addressCountry': 'United States of America', 'addressLocality': 'NJ - Mount Laurel, 1800 Bishops Gate'}}]",['United States'],,,,['FULL_TIME'],https://comcast.wd5.myworkdayjobs.com/Comcast_Careers/job/NJ---Mount-Laurel-1800-Bishops-Gate/Comcast-Cybersecurity--Engineer-4--Cyber-Security-Engineering---Identity-and-Access-Management_R385883,workday,"{'text': 'Make your mark at Comcast -- a Fortune 30 global media and technology company. From the connectivity and platforms we provide, to the content and experiences we create, we reach hundreds of millions of customers, viewers, and guests worldwide. Become part of our award-winning technology team that turns big ideas into cutting-edge products, platforms, and solutions that our customers love. We create space to innovate, and we recognize, reward, and invest in your ideas, while ensuring you can proudly bring your authentic self to the workplace. Join us. You’ll do the best work of your career right here at Comcast. (In most cases, Comcast prefers to have employees on-site collaborating unless the team has been designated as virtual due to the nature of their work. If a position is listed with both office locations and virtual offerings, Comcast may be willing to consider candidates who live greater than 100 miles from the office for the remote option.) Job Summary ""Responsible for how users within the company are given an identity - and how it is protected, including saving critical applications, data and systems from unauthorized access while managing the identities and access rights of people both inside and outside the organization. Responsible for contributing towards the Define, Build, Implement and Maintain processes to secure the organizations resources. These resources includes user identities, physical assets as well as the wide range of business applications that users use every day to access intellectual property or confidential information. Exercises solid knowledge of engineering skills and methodology with a working knowledge of applicable cyber security compliance standards. Integrates knowledge of business and functional priorities. Acts as a key contributor in a complex and crucial environment. May lead teams or projects and shares expertise. Employees at all levels are expect to: - Understand our Operating Principles; make them the guidelines for how you do your job - Own the customer experience - think and act in ways that put our customers first, give them seamless digital options at every touchpoint, and make them promoters of our products and services - Know your stuff - be enthusiastic learners, users and advocates of our game-changing technology, products and services, especially our digital tools and experiences - Win as a team - make big things happen by working together and being open to new ideas - Be an active part of the Net Promoter System - a way of working that brings more employee and customer feedback into the company - by joining huddles, making call backs and helping us elevate opportunities to do better for our customers - Drive results and growth - Respect and promote inclusion and diversity - Do what\'s right for each other, our customers, investors and our communities"" Job Description Job Requirements Collaborate with project teams to understand and translate business and user needs into requirements. Provide technical leadership regarding best practices, procedures, and techniques. Guide team members as required. Oversee software update process for existing applications and coordinate the roll-out of software releases. Track project progress and report findings and prepare periodic reports to leadership team. Design, implement, and support CI/CD best practices across our projects. Design and implement cloud-based solutions. Supervise the design and implementation of Observability best practices. Coordinate BAU activities across multiple projects to ensure our applications comply with Comcast Cybersecurity policies and standards. Technical Requirements: Design infrastructure requirements using the Infrastructure as Code approach. Supervise software development using a serverless architecture with AWS services like Lambda, DynamoDB, and ECS. Work with AWS CloudFormation and shell scripts to build and maintain the required infrastructure. Design, build, and maintain CI/CD pipelines using AWS CodePipeline and AWS CodeBuild services. Support production environments. Troubleshoot issues within containerized and serverless application environments. Analyze application logs and metrics using tools like AWS CloudWatch, Datadog, and Elasticsearch. Core Responsibilities Lead and contribute to design and troubleshooting sessions with Cybersecurity Operations and Application Development teams. Coordinate solution deployments with stakeholders. Review business requirement to aide in the creation of functional design and release documentation. Work with Cybersecurity Operations and Risk teams to ensure solutions comply with the organization’s standards and policies. Implement and maintain security solutions supporting the Identity and Access Management program. Build and maintain operation and configuration documentation, and diagrams. Conduct proactive analysis to determine if systems are performing optimally. Consistent exercise of independent judgment and discretion in matters of significance. Regular, consistent and punctual attendance. Must be able to work nights and weekends, variable schedule(s) as necessary. Other duties and responsibilities as assigned. Employees at all levels are expected to: Understand our Operating Principles; make them the guidelines for how you do your job. Own the customer experience - think and act in ways that put our customers first, give them seamless digital options at every touchpoint, and make them promoters of our products and services. Know your stuff - be enthusiastic learners, users and advocates of our game-changing technology, products and services, especially our digital tools and experiences. Win as a team - make big things happen by working together and being open to new ideas. Be an active part of the Net Promoter System - a way of working that brings more employee and customer feedback into the company - by joining huddles, making call backs and helping us elevate opportunities to do better for our customers. Drive results and growth. Respect and promote inclusion & diversity. Do what\'s right for each other, our customers, investors and our communities. Disclaimer: This information has been designed to indicate the general nature and level of work performed by employees in this role. It is not designed to contain or be interpreted as a comprehensive inventory of all duties, responsibilities and qualifications. We believe that benefits should connect you to the support you need when it matters most, and should help you care for those who matter most. That\'s why we provide an array of options, expert guidance and always-on tools that are personalized to meet the needs of your reality—to help support you physically, financially and emotionally through the big milestones and in your everyday life. Please visit the benefits summary on our careers site for more details. Education Bachelor\'s Degree While possessing the stated degree is preferred, Comcast also may consider applicants who hold some combination of coursework and experience, or who have extensive related professional experience. Certifications (if applicable) Relative Work Experience 7-10 Years Comcast is proud to be an equal opportunity workplace. We will consider all qualified applicants for employment without regard to race, color, religion, age, sex, sexual orientation, gender identity, national origin, disability, veteran status, genetic information, or any other basis protected by applicable law. At Comcast , you have the power to connect the world. Your career options are endless as you grow in your career. Explore your future with access to a variety of teams, locations, and resources in an expanding network. You can also explore additional opportunities at our company, NBCUniversal.'}"
791824177,Lead Cyber Security Engineer,MGM Resorts International,,2024-08-29T00:00:00+00:00,,"[{'@type': 'Place', 'address': {'@type': 'PostalAddress', 'addressCountry': 'United States of America', 'addressLocality': 'Home Office - US, NV'}}]",['United States'],,,,['FULL_TIME'],https://mgmresorts.wd5.myworkdayjobs.com/MGMCareers/job/Home-Office---US-NV/Lead-Cyber-Security-Engineer_254487,workday,"{'text': ""Our Company has one exciting mission: To entertain the human race and provide an unforgettable escape. Delivering excellence for our guests, and contributing to building and sustaining our communities, requires collaboration from diverse teams of world-class talent. Our iconic MGM Resorts brands offer a wide variety of exciting career opportunities, each with access to unlimited growth. PRIMARY PURPOSE: The Cyber Security Lead Application Engineer is an individual contributor who works closely with developers to help improve the security of their products and services, as well as implementing technical solutions to address security weaknesses, and working with relevant stakeholders to implement them. The Cyber Security Application Engineer is responsible for systems, applications, and data. They will ensure that the applications are implemented with high standards and are secure. Lead efforts to secure code, including code reviews, project security reviews, pen testing support, and application scanning throughout the stages of SDLC. Support the engineering security team to help ensure that all security platforms are designed and implemented with best practices in mind. Work closely with cross-functional teams (Engineering, Dev, Product, IT) while carrying out daily tasks. Work closely with developers to help improve the security of their products and services, as well as implementing technical solutions to address security weaknesses, and working with relevant stakeholders to implement them. Manage integration with vulnerability check tools such as Static Code Analysis and Dynamic Code Analysis tools. Work together with cross Business Unit teams on executing agreed upon standardized security solutions and integrations. MINIMUM REQUIREMENTS: Bachelor's Degree or equivalent experience 5+ years of prior relevant experience KNOWLEDGE, SKILLS, AND ABILITIES At MGM Resorts, we exist to entertain the human race and provide an unforgettable escape. From delivering excellence for our guests to building and sustaining our communities, you can join our diverse teams of world-class talent and thrive in our collaborative environment. Our iconic MGM Resorts brands offer everyone a wide variety of exciting career opportunities with access to unlimited growth. Be part of a unique world filled with anticipation, entertainment and unparalleled experiences — combined with competitive rewards and exclusive perks. Together, we will use our meaningful relationships to continue to build our authentic culture. We know the importance of respecting each other’s differences. We embrace and leverage our diversity to achieve best-in-class experiences and create stronger ties with our employees, guests, suppliers and community partners. We stay committed to taking strong, principled stands on equality to better unify our world. MGM Resorts International develops, builds and operates unique destination resorts designed to provide a total resort experience, including first-class accommodations and dining, world-class entertainment, state-of-the-art meeting and convention facilities, and high-quality retail and gaming experiences. We know the importance of respecting each other’s differences. We embrace and leverage our diversity to achieve best-in-class experiences and create stronger ties with our employees, guests, suppliers and community partners. We stay committed to taking strong, principled stands on equality to better unify our world. MGM Resorts International believes in providing opportunity for every employee to grow, develop and succeed in a work environment where you can be your best. We encourage you to explore our job opportunities. If you are an individual with a disability and need a reasonable accommodation for any part of the application process, or in order to perform the essential functions of a position, please contact us at talent@mgmresorts.com We are an Equal Opportunity Employer. We are also committed to protecting the privacy of visitors to our employment application site, including the protection of any personal information provided to us. For more information about MGM Resorts International, including our privacy policy and commitment to diversity and inclusion, please visit http://www.mgmresorts.com/careers. For California residents, also see our California Privacy Notice that describes the categories of personal information and sensitive personal information we collect and provides certain details about our processing of that information.""}"
